{
  "$schema": "https://json-schema.org/draft/2020-12/schema",
  "$id": "https://deeptimes.dev/dsk/seed.schema.json",
  "type": "object",
  "additionalProperties": false,
  "required": ["schemaVersion", "collection", "upsertBy", "items"],
  "properties": {
    "schemaVersion": { "const": 1 },
    "collection": { "type": "string", "minLength": 1 },
    "upsertBy": { "type": "array", "minItems": 1, "uniqueItems": true, "items": { "type": "string", "minLength": 1 } },
    "defaults": { "type": "object" },
    "refs": {
      "type": "object",
      "additionalProperties": {
        "type": "object",
        "additionalProperties": false,
        "required": ["collection"],
        "properties": {
          "collection": { "type": "string", "minLength": 1 },
          "field": { "type": "string", "minLength": 1 },
          "from": { "type": "string", "minLength": 1 },
          "scope": { "type": "array", "items": { "type": "string", "minLength": 1 } },
          "nullable": { "type": "boolean" },
          "keepSource": { "type": "boolean" }
        }
      }
    },
    "items": { "type": "array", "items": { "type": "object" } }
  }
}
