{
  "schemaVersion": 1,
  "collection": "course_categories",
  "upsertBy": ["slug"],
  "defaults": {
    "status": "published"
  },
  "items": [
    {
      "slug": "software-development",
      "name": "软件开发",
      "description": "编程语言、工程实践与软件架构。",
      "icon": "code",
      "sort": 10
    },
    {
      "slug": "product-design",
      "name": "产品设计",
      "description": "产品方法、交互设计与用户研究。",
      "icon": "design_services",
      "sort": 20
    },
    {
      "slug": "data-ai",
      "name": "数据与 AI",
      "description": "数据分析、机器学习与 AI 应用开发。",
      "icon": "smart_toy",
      "sort": 30
    }
  ]
}
